{
  "name": "Paul Hausser",
  "source_language": "English",
  "rank": "General der Waffen-SS",
  "nationality": "Germany",
  "PersonID": "01KPSGC0CX0PN4DDD7AA6PFWAY",
  "event_mentions": [
    {
      "MentionID": "01KQ5GAWX1MB3C79RNATD4E7RG",
      "Event_Name": "The Breakthrough",
      "EventID": "01KPV9Y9WAD9VQWAAVMB9K901P",
      "Sub_event_Name": "Hausser's plan to re-establish a main line of resistance to Hébécrevon is undermined by disrupted communications and the collapse of Panzer Lehr, Kampfgruppe Heinz, and the 275th Division regiment, leaving the 352d Division's flank exposed.",
      "Sub_eventID": "01KHXPB9N4P6R8T0V2X4Z6B8D0",
      "book": "Breakout and Pursuit",
      "author": "Martin Blumenson",
      "series": "United States Army in World War II",
      "context": null,
      "original_text": "Hausser hoped that retention of la Chapelle-en-Juger would permit him to re-establish a main line of resistance eastward to Hébécrevon, but he was unaware of the extent of the disaster that had overcome his troops. His command channels had been disrupted by the COBRA bombing and were saturated with overdue messages. Counting on the 5th Parachute Division, which controlled one regiment, to hold its positions near the Taute River and prevent the Americans from broadening their breach, he was not disappointed, for the paratroopers checked any genuine advance by the 330th Infantry. But Hausser also counted on the 352d Division (under II Parachute Corps) to hold the west bank of the Vire River and prevent an American penetration near Hébécrevon.",
      "rank": "General",
      "nationality": "Germany",
      "position_at_event": "Army commander",
      "life_event": "Hoped that retention of la Chapelle-en-Juger would permit him to re-establish a main line of resistance eastward to Hébécrevon, unaware of the extent of the disaster due to disrupted command channels saturated with overdue messages; counted on 5th Parachute Division to hold near Taute River and 352d Division to hold west bank of Vire River"
    },
    {
      "MentionID": "01KQ5CZW5PE7P7WNQ3EFV37DXB",
      "Event_Name": "The \"Incalculable\" Results",
      "EventID": "01KHXPA7K3M8N7V4Q2J9H5F3D2",
      "Sub_event_Name": "Kluge's responsibility for not correcting Hausser's inadequate preparations and his subsequent criticism and replacement of key Seventh Army staff",
      "Sub_eventID": "01KHXPG2R4T6V8X9Z2A4B6C8D9",
      "book": "Breakout and Pursuit",
      "author": "Martin Blumenson",
      "series": "United States Army in World War II",
      "context": null,
      "original_text": "Concerned with the Panzer Group West sector... he had failed to note Hausser's inadequate preparations... Kluge criticized Hausser explicitly soon after COBRA began for his employment of the 2d SS Panzer Division... He condemned Hausser's helplessness... Kluge was certain that Hausser understood the significance of Coutances... his surprise... when he received word... of Hausser's plan to have the LXXXIV Corps... escape... by attacking southeast... Kluge's countermand of Hausser's order... Hausser's act brought... Kluge's dissatisfaction... again he countermanded Hausser's order",
      "nationality": "Germany",
      "position_at_event": "Commander",
      "life_event": "Made inadequate preparations, criticized by Kluge for employment of 2d SS Panzer Division and helplessness, planned southeast attack from Coutances area against Kluge's wishes, order countermanded"
    },
    {
      "MentionID": "01KQ5GAWXWXJZSQW1F64MW1S41",
      "Event_Name": "The Breakthrough",
      "EventID": "01KPV9Y9WAD9VQWAAVMB9K901P",
      "Sub_event_Name": "Hausser reports seven American penetrations and the near-destruction of Panzer Lehr. He proposes a general withdrawal of LXXXIV Corps units to Coutances while attempting to hold an outpost line near la Chapelle-en-Juger and Geffosses.",
      "Sub_eventID": "01KHXPEJ9S1T3V5X7Z9B1D3F5G",
      "book": "Breakout and Pursuit",
      "author": "Martin Blumenson",
      "series": "United States Army in World War II",
      "context": null,
      "original_text": "By late afternoon on 25 July he had counted seven distinct American penetrations of his Lessay-St. Lô defensive line. He had also received Bayerlein's report that Panzer Lehr had practically no infantry left and that the division was about to cease to exist as an organized unit. Hausser therefore proposed a general withdrawal to Coutances of those LXXXIV Corps units in the coastal sector of the Cotentin. Still hoping that la Chapelle-en-Juger was not entirely lost, he thought of manning an outpost line between that village and Geffosses, the latter near the west coast.",
      "rank": "General",
      "nationality": "Germany",
      "position_at_event": "Army commander",
      "life_event": "Counted seven distinct American penetrations of his Lessay-St. Lô defensive line; received Bayerlein's report on Panzer Lehr; proposed a general withdrawal to Coutances of those LXXXIV Corps units in the coastal sector of the Cotentin while hoping to man an outpost line between la Chapelle-en-Juger and Geffosses"
    },
    {
      "MentionID": "01KPV90Q6ZEN9XMKXPC9X517AZ",
      "Event_Name": "The Mortain Counterattack",
      "EventID": "01KPSK6MWABDFK9BGQQY5RGS1M",
      "Sub_event_Name": "Hitler's criticism of Kluge's handling of the attack, decision to take direct control, and issuance of orders for a renewed, more powerful thrust to Avranches using additional SS panzer divisions",
      "Sub_eventID": "01KHXPJCR7M4N8P3Q5R7T9V2X7",
      "book": "Breakout and Pursuit",
      "author": "Martin Blumenson",
      "series": "United States Army in World War II",
      "context": null,
      "original_text": "Transmitting Hitler's order to Hausser... Hausser, too, admitted failure on 7 August. He ascribed the causes to the Allied air superiority, the immobility of the 116th Panzer Division, and a stronger than expected American resistance. Although additional striking forces augmented the chances of regaining Avranches, continuing threats to the army's flanks increased the chances of disaster. But since Hitler felt that the outcome of the war depended on another attack toward Avranches, there was no choice.",
      "rank": "General der Waffen-SS",
      "nationality": "Germany",
      "position_at_event": "Commander of Seventh Army",
      "life_event": "Received Hitler's order via Kluge to continue the attack toward Avranches; admitted failure of the 7 August attack citing Allied air superiority, immobility of 116th Panzer Division, and stronger American resistance; began preparing for renewed effort despite risks to flanks"
    },
    {
      "MentionID": "01KQ5CZW4TSP0SW2SCZ4446BR6",
      "Event_Name": "The \"Incalculable\" Results",
      "EventID": "01KHXPA7K3M8N7V4Q2J9H5F3D2",
      "Sub_event_Name": "Hausser's pre-COBRA dispositions, failure to create armored reserves despite Kluge's suggestion, and resulting vulnerability of panzer divisions",
      "Sub_eventID": "01KHXPE5F8G9H2J4K6M7N9P2Q4",
      "book": "Breakout and Pursuit",
      "author": "Martin Blumenson",
      "series": "United States Army in World War II",
      "context": null,
      "original_text": "From the night of 13 July... Hausser was increasingly free to regroup his forces... Hausser had two panzer divisions... Kluge had suggested to Hausser that he pull his two panzer divisions out of the line... Hausser, on the other hand, had been reluctant... He had consequently held the armored divisions in place... Hausser might have visualized his task... Hausser, who could have justified a withdrawal... had failed to prepare even rally points to the rear.",
      "nationality": "Germany",
      "position_at_event": "Commander",
      "life_event": "Made pre-COBRA dispositions, failed to create armored reserves despite Kluge's suggestion, held panzer divisions in place resulting in vulnerability"
    },
    {
      "MentionID": "01KPSH39ENGNZT8RTWCZQXEB6P",
      "Event_Name": "The Mortain Counterattack",
      "EventID": "01KPSH2NDSQQSKZ6YEC7WDQEWB",
      "Sub_event_Name": "Request by XLVII Panzer Corps commander to postpone attack due to 1st SS Panzer Division delays and 116th Panzer Division non-compliance",
      "Sub_eventID": "01KPSH2NDS4T5W2ZBJMWN7YX1S",
      "book": "Breakout and Pursuit",
      "author": "Martin Blumenson",
      "series": "United States Army in World War II",
      "context": null,
      "original_text": "At H Hour--2200, 6 August--Hausser received a phone call from Funck, the XLVII Panzer Corps commander, who wanted the attack postponed. ... Hausser was inclined to agree with Funck that the news of both incidents was serious, but he was unwilling to postpone the attack. Hausser's only concession was to delay the jump-off until midnight to give the 1st SS Panzer Division two more hours to come forward. He did nothing about Schwerin.",
      "rank": "General der Waffen-SS",
      "nationality": "Germany",
      "position_at_event": "Commander of Seventh Army",
      "life_event": "Received phone call from Funck requesting postponement of attack; decided to delay jump-off until midnight but refused to postpone the attack or relieve Schwerin"
    },
    {
      "MentionID": "01KQ5CZXMGE16DW4QTM1RJ8F9X",
      "Event_Name": "COBRA",
      "EventID": "01KPV9XDKF7X7DKGCCEX7BCZ2Y",
      "Sub_event_Name": "Seventh Army commander Hausser is ordered to withdraw armored divisions from the line to form a flexible reserve but takes only limited steps; he maintains a static defense in the Cotentin, underestimates American offensive potential west of the Vire, and fails to detect the COBRA build-up.",
      "Sub_eventID": "01KPV9XDKFJ7HST5ES3E07RJ4K",
      "book": "Breakout and Pursuit",
      "author": "Martin Blumenson",
      "series": "United States Army in World War II",
      "context": null,